file_name,uni,wylie,url,dept,grade,char_len,audio_len,path,inf
STT_CS-D-2012-P-D-B07-5-R-03_0093_820068_to_829009,བསྟན་འཛིན་དེ་དག་འདི་དེ་ག་རེ་ཡོད་རེད། ཁོ་སྤོ་སྤོ་དང་རྨོ་རྨོ་ཆགས་རེད་ད་རེད། ཁོ་ཀ་ཅི་ཁྱོ་ག ཁྱོ་ག་དང་སྐྱེད་དམན། ཨ་ནས་ཁོ་ཚོ།  ,bstan 'dzin de dag 'di de ga re yod red/_kho spo spo dang rmo rmo chags red da red/_kho ka ci khyo ga_khyo ga dang skyed dman/_a nas kho tsho/__,https://d38pmlk0v88drf.cloudfront.net/wav16k/STT_CS-D-2012-P-D-B07-5-R-03_0093_820068_to_829009.wav,STT_CS,3,121,8.941,wav16k/STT_CS-D-2012-P-D-B07-5-R-03_0093_820068_to_829009.wav,བསྟན་འཛིན་དེ་དང་དི་དེ་ག་རེ་ལབ་གོ་རེད། ོསྤོ་སྤོ་དང་རྨོ་རྨོ་ཆགས་རེད་ད་རཱ། ཁོ་ཀ་ཅི་ོསེ་།ཨནཁོ་ཚོ་
STT_CS-D-2012-P-D-B07-5-R-03_0094_830292_to_838341,ཨ་ནས་ཁོང་ཚོ་ཡོད་བ། ཁོ་ཡོད་བ། ཁོ་ཀ་ཅི་རྨོ་རྨོ་དེ་ཡོད་བ། གཅིག་བཏུང་སྙིང་བྲོ་རེད་ད་རཱ། ཞིམ་པོ་གཅིག་བཏུང་སྙིང་བྲོ་སོང་ང་། ཕར་ལ་གཅིག་ཡོད་རེད་ད་རེད་བ།  ,a nas khong tsho yod ba/_kho yod ba/_kho ka ci rmo rmo de yod ba/_gcig btung snying bro red da rA/_zhim po gcig btung snying bro song nga /_phar la gcig yod red da red ba/__,https://d38pmlk0v88drf.cloudfront.net/wav16k/STT_CS-D-2012-P-D-B07-5-R-03_0094_830292_to_838341.wav,STT_CS,3,146,8.049,wav16k/STT_CS-D-2012-P-D-B07-5-R-03_0094_830292_to_838341.wav,ཨེ་ནས་ཁོ་ཚོ་ཡོད་བ། ཁོ་ཡོད་བ། ཁོ་ཀ་ཅི་རྨོ་རྨོ་དེ་ཡོད་བ། གཅིག་བཏུང་སྙིང་བྲོ་རེད་ད་རཱ། ཞིམ་པོ་དེ་བཏུང་སྙིང་བྲོ་སོང་། ཨེ་ནས་ཕར་ལ་གཅིག་ཡོད་རེད་ད་རཱ།
STT_CS-D-2012-P-D-B07-5-R-03_0095_844905_to_848179,ཨ་ནས་ཡོད་བ། ཨ་ནས་ཕར་ལ་གཅིག་བཏུང་སྙིང་བྲོ་རེད་ད་རཱ།  ,a nas yod ba/_a nas phar la gcig btung snying bro red da rA/__,https://d38pmlk0v88drf.cloudfront.net/wav16k/STT_CS-D-2012-P-D-B07-5-R-03_0095_844905_to_848179.wav,STT_CS,3,52,3.274,wav16k/STT_CS-D-2012-P-D-B07-5-R-03_0095_844905_to_848179.wav,ཨེ་ནས་ཡོད་བ། ཨེ་ནས་ཕར་ལ་གཅིག་བཏུང་སྙིང་བྲོ་རེད་ད་རཱ། ཨེ་ནས།
STT_CS-D-2012-P-D-B07-5-R-03_0096_848719_to_858629,ཁོས་ཡོད་བ། གཅིག་རྒྱུགས་རེད་ད་རཱ། ཨ་ནས་ཕར་ལ་ག་རེ་རག་གི་རེད་ལབ་དགོས་པས། ཤོག་སྒམ་གཅིག་མ་གཏོགས་རག་ཡོད་མ་རེད་ད། ཨ་ནས་ཁོས་བསམས་བློ་བཏང་རེད་ད། ཤོག་སྒམ་ག་རེ་བྱས་ནས་རག་ཡིན་ནམ་ལབ་རེད་ད། ཨ་ནས་ད་བཞག་ཤོག་ལབ་རེད། ངའི་པད་ཤག་འཕྲོ་བརླག་ལབ་ནས་ ,khos yod ba/_gcig rgyugs red da rA/_a nas phar la ga re rag gi red lab dgos pas/_shog sgam gcig ma gtogs rag yod ma red da/_a nas khos bsams blo btang red da/_shog sgam ga re byas nas rag yin nam lab red da/_a nas da bzhag shog lab red/_nga'i pad shag 'phro brlag lab nas _,https://d38pmlk0v88drf.cloudfront.net/wav16k/STT_CS-D-2012-P-D-B07-5-R-03_0096_848719_to_858629.wav,STT_CS,3,226,9.91,wav16k/STT_CS-D-2012-P-D-B07-5-R-03_0096_848719_to_858629.wav,ཁོས་ཡོད་བ་གཅིག་རྒྱུག་རེད་ད་རཱ། ཨེ་ནས་ཕར་ལ་ག་རེ་རག་རེད་ལབ་དགོས་བས། ཤོག་སྒམ་གཅིག་མེ་གཏོགས་རག་ཡོད་མ་རེད་ད། ཨེ་ནས་ཁོས་བསམ་བློ་བཏང་རེད་ད། ཤོག་སྒམ་ག་རེ་བྱས་ནས་རག་ཡོད་ན་ལབ་རེད་ད། ཨེ་ནས་ད་བཞག་ཤོག་ལབ་ནས། ངའི་པད་ཤག་འཕྲོ་བརླག་ལབ་ནས་ཁོ
STT_CS-D-2012-P-D-B07-5-R-03_0097_858629_to_868539,ཁོ་ཁོང་ཁྲོ་ཟ་ནས་འགྲོ་རེད་ད། ཨ་ནས་ག་རེ་ལབ་དགོས་རེད། ཁོས་ཐཱ་ལི་འདྲ་པོ་གཅིག་ཁྱེར་རེད་ད། ཨ་ནས་བཀྲུས་རེད་ད། བཀྲུས། བཀྲུས། བཀྲུས། བཀྲུས། ཨ་ནས་མི་མང་ཆེ་བས་རོགས་པ་བྱས་ནས་ཡོད་བ།  ,kho khong khro za nas 'gro red da/_a nas ga re lab dgos red/_khos thA li 'dra po gcig khyer red da/_a nas bkrus red da/_bkrus/_bkrus/_bkrus/_bkrus/_a nas mi mang che bas rogs pa byas nas yod ba/__,https://d38pmlk0v88drf.cloudfront.net/wav16k/STT_CS-D-2012-P-D-B07-5-R-03_0097_858629_to_868539.wav,STT_CS,3,170,9.91,wav16k/STT_CS-D-2012-P-D-B07-5-R-03_0097_858629_to_868539.wav,ཁོང་ཁྲོ་ཟ་ནས་འགྲོ་རེད་ད། ཨེ་ནས་ག་རེ་ལབ་དགོས་རེད། ཁོཡིས་ཡོད་བ།་ཐ་ལིང་འདྲ་བོ་ཅིག་བྱས་རེད་ད། ཨ་ནས་ཀྲུས་རེད་ད། བཀྲུས་བཀྲུས་བཀྲི་ཀ་ྲུས། ཨ་ནས་མི་མང་ཆེ་བ་ཅི་རོགས་པ་བྱས་ནས་ཡོད་བ། ོགས
STT_CS-D-2012-P-D-B07-5-R-03_0098_868539_to_878449,རོགས་པ་བྱེད་རོགས། རོགས་པ་བྱེད་རོགས། ཨ་ནས་ཡང་ཉིན་མ་གཅིག་ཡང་ཁོ་ཡོད་བ། ཉིན་མ་གཅིག་རོགས་པ་བྱས་ནས་པད་ཤག་རག་རེད་ད། ཨ་ནས་པད་ཤག་དེ་ག་རེ་བྱས་རེད་ལབ་དགོས་པས། བསྟན་འཛིན་གྱིས་པད་ཤག་དེས་ཀཱ་ཊེ་འདྲ་པོ་བྲིས་ ,rogs pa byed rogs/_rogs pa byed rogs/_a nas yang nyin ma gcig yang kho yod ba/_nyin ma gcig rogs pa byas nas pad shag rag red da/_a nas pad shag de ga re byas red lab dgos pas/_bstan 'dzin gyis pad shag des kA Te 'dra po bris _,https://d38pmlk0v88drf.cloudfront.net/wav16k/STT_CS-D-2012-P-D-B07-5-R-03_0098_868539_to_878449.wav,STT_CS,3,192,9.91,wav16k/STT_CS-D-2012-P-D-B07-5-R-03_0098_868539_to_878449.wav,རོགས་པ་བྱས། རོགས་པ་བྱས།རོ། ཨེ་ནས་ཡོདཉི་མ་གཅིག་ཡང་ཁོ་ཡོད་བ། ཉི་མ་གཅིག་རོགས་པ་བྱས་ནས་པད་ཤག་རག་རེད་ད། ཨནསཔད་ཤག་དེ་ག་རེ་བྱས་རེད་ལབ་དགོས་བེ། བསྟན་འཛིན་གྱིས་པད་ཤག་དེ་ཁཱཋྀ་འདྲ་བོ་བྲིས།།
STT_CS-D-2012-P-D-B07-5-R-03_0109_977222_to_986755,གཅིག གཅིག་ཀྱང་ལྷག་ཡོད་མ་རེད་ད། ཕ་གིར་ཡོད་རེད་ད། ཨ་ནས་ཁོང་ཚོ་ཡོད་བ། ཤེལ་ཏོག་ཨེ་འདྲའི་འདྲ་པོ་དང་། ཨེ་འདྲའི་འདྲ་པོ་བཙོང་གི་ཡོད་རེད་ད། ཨ་ནས། ཁོང་ཚོ་བཙོང་བཙོང་ ,gcig_gcig kyang lhag yod ma red da/_pha gir yod red da/_a nas khong tsho yod ba/_shel tog e 'dra'i 'dra po dang /_e 'dra'i 'dra po btsong gi yod red da/_a nas/_khong tsho btsong btsong _,https://d38pmlk0v88drf.cloudfront.net/wav16k/STT_CS-D-2012-P-D-B07-5-R-03_0109_977222_to_986755.wav,STT_CS,3,155,9.533,wav16k/STT_CS-D-2012-P-D-B07-5-R-03_0109_977222_to_986755.wav,གཅིག་གཅིག་ཀྱང་བརླག་ཡོད་མ་རེད་ད། བ་ཕྱུགས་འདྲ་བོ་ད། ཨ་ནས་ཁོང་ཚོ་ཡོད་བ། ཤེལ་མཏོག་ཨེ་འདྲའི་འདྲ་བོ་དང་། ཨེ་འདྲའི་འདྲ་བོ་བཙོན་གི་ཡོད་རེད་ད། ཨེ་ནས། ཁོང་ཚོ་བཙོན་བཙོང
STT_CS-D-2012-P-D-B07-5-R-03_0110_986755_to_996287,བཙོང་བཙོང་བྱས་ནས་ཉིན་མ་གཅིག་ཁོང་ཚོ་ཡོད་བ། དུག་སློག་འཚོང་ཉན་ཞིག་ཆགས་རེད་ད་རཱ། དུག་སློག་འཚོང་མཁན་དེ་ཨ་ནས་མང་པོ་དཔེ་ཡོད་རེད་ད། དུག་སློག དུག་སློག་བཙོང་ཨེ་འདྲའི་བྱས་རེད་བ། ཨེ་ནས།  ,btsong btsong byas nas nyin ma gcig khong tsho yod ba/_dug slog 'tshong nyan zhig chags red da rA/_dug slog 'tshong mkhan de a nas mang po dpe yod red da/_dug slog_dug slog btsong e 'dra'i byas red ba/_e nas/__,https://d38pmlk0v88drf.cloudfront.net/wav16k/STT_CS-D-2012-P-D-B07-5-R-03_0110_986755_to_996287.wav,STT_CS,3,175,9.532,wav16k/STT_CS-D-2012-P-D-B07-5-R-03_0110_986755_to_996287.wav,བཙོང་བྱས་ནས་ཉི་མ་གཅིག་ཁོང་ཚོ་ཡོད་བ། དུག་སློག་བཙོང་མྱི་གཅིག་ཆགས་རེད་ད་རཱ། དུག་སློག་བཙོང་མྱན་དེ། ཨ་ནས་མང་པོ་དཔེ་ཡོད་རེད་ད། དུག་སློག དུག་སློག་བཙོང་ཨེ་འདྲའི་བྱས་ྱས། ཨ་ནས། ཨ་ནས
STT_CS-D-2012-P-D-B07-5-R-03_0031_270261_to_279779,འོ་ལབ་ཀི་རཱ། ཨེ་ནས་ཁོ་ཚོ་རྩེད་མོ་བརྩེས་རེད་ད་རཱ། ཨེ་ནས་བུ་དེ་ཚོ་ཡོད་བ་བུ་མོའིགསང་སྤྱོད་ལ་ཅིག་འཛུལ་རེད་ད་རཱ། ཨེ་ནས། བུ་ཚང་མ་ཡོད་བ། བུ་མོ་གསང་སྤྱོད་ལ་ཧང་སང་རེད་ད་རཱ། ཨེ་ནས་བུ་ ,'o lab ki rA/_e nas kho tsho rtsed mo brtses red da rA/_e nas bu de tsho yod ba bu mo'igasang spyod la cig 'dzul red da rA/_e nas/_bu tshang ma yod ba/_bu mo gsang spyod la hang sang red da rA/_e nas bu _,https://d38pmlk0v88drf.cloudfront.net/wav16k/STT_CS-D-2012-P-D-B07-5-R-03_0031_270261_to_279779.wav,STT_CS,3,174,9.518,wav16k/STT_CS-D-2012-P-D-B07-5-R-03_0031_270261_to_279779.wav,་་ནས་འོ་འ་ལབ་ཀི་རཱ། ཨེ་ནས་ཁོང་ཚོ་རྩེད་མོ་རྩེས་རེད་ད་རཱ། ཨེ་ནས་བུབུ་དེ་ཚོ་ཡོད་བ། བུ་མོ་གསང་སྤྱོད་ནང་གཅིག་འཛུལ་རེད་ད་རཱ། ཨེ་ནས་བུ་ཚང་མ་ཡོད་བ། བུ་མོའ་གསང་སྤྱོད་ལ་ཧང་སང་རེད་ད་རཱ། ནབ
STT_CS-D-2012-P-D-B07-5-R-03_0032_279779_to_289296,བུ་མོ་བུ་མོ་བུ་ཚང་མ་བུ་མོ་གསང་སྤྱོད་ནང་འཛུལ་རེད་རཱ། པར་རྫུན་མ་སྒར་ནས། འོ་དེ། ཁོ་ཚོ་ཧང་སང་རེད་ད། ཨེ་ནས་ཁོ་ཚོ་ཕར་ལ་འཛུལ་རེད་ད་རཱ། ཨེ་ནས་ ,bu mo bu mo bu tshang ma bu mo gsang spyod nang 'dzul red rA/_par rdzun ma sgar nas/_'o de/_kho tsho hang sang red da/_e nas kho tsho phar la 'dzul red da rA/_e nas _,https://d38pmlk0v88drf.cloudfront.net/wav16k/STT_CS-D-2012-P-D-B07-5-R-03_0032_279779_to_289296.wav,STT_CS,3,135,9.517,wav16k/STT_CS-D-2012-P-D-B07-5-R-03_0032_279779_to_289296.wav,བུ་མོ། བུ་མོ། བུ་ཚང་མ་བུ་མོའི་གསང་སྤྱོད་ནང་འཛུལ་རེད། པར་རྫུན་མ་བཀར་ནས། འོ་དེ་ཁོང་ཚོ་ཧང་སང་བསྡད་རེད་ད་རཱ། འེ་ནས་ཁོང་ཚོ་ཡ་ཕར་ནང་འཛུལ་རེད་ད་རཱ། ཨེ་ནས།
STT_CS-D-2012-P-D-B07-5-R-03_0033_289296_to_298814,བུ་གཞན་པ་ཅིག་འདུག་ག་འོ་དེས་བུ་མོ་དེ་ལ་ཡོད་བ། གཅིག་མགོའི་སྒང་ལ་ཧཕེན་གཅིག་གྱོན་རྒྱོ་མཐོང་རེད་ད་རཱ། ཧཕེན་དེ་ཁོ་ལ་ཇཱོཀ་ཡ་ཡུད་སླང་རེད་ད་རཱ། ཡ་ཡུད་སྙིང་རྗེ་མོ་འདུག་ལབ་ནས། ཨེ་ནས།  ,bu gzhan pa cig 'dug ga 'o des bu mo de la yod ba/_gcig mgo'i sgang la haphen gcig gyon rgyo mthong red da rA/_haphen de kho la jA+oka ya yud slang red da rA/_ya yud snying rje mo 'dug lab nas/_e nas/__,https://d38pmlk0v88drf.cloudfront.net/wav16k/STT_CS-D-2012-P-D-B07-5-R-03_0033_289296_to_298814.wav,STT_CS,3,173,9.518,wav16k/STT_CS-D-2012-P-D-B07-5-R-03_0033_289296_to_298814.wav,བུ་གཞན་པ་གཅིག་འདུག་ག འོ་དེ་བུ་མོ་དེ་ལ་ཡོད་བ། ཅིག་མགོ་སྒང་ལ་ཧཱབཔ་ཕན་གཅིག་གྱོན་རྐྱོ་མཐོང་རེད་ད་རཱ། ཨེ་ནས་ཧཱབ་ཕན་དེ་ཁོ་ལ་ཇོཀ་ཡ་ཡུད་བསལངས་རེད་ད། ཉི་་སྙིང་རྗེ་མོ་འདུག་ལབ་ནས། ཨ་ནས
STT_CS-D-2012-P-D-B07-5-R-03_0034_298814_to_308331,ཉི་མ་གཅིག་བུ་དེ་ལ་ཡོད་ཨ་ཕཱོན་གཅིག་བསླེབས་རེད་ད་རཱ། ཕཱོན་དེ་ལ་ཨེ་འདྲའི་ལབ་རེད་ད། གཅིག་ག་རེ་ལབ་གོ་རེད་ཕཱོན་དེ་ལ་ཨེ་འདྲའི་ལབ་རེད་ད། ག་རེ་ལབ་གོ་རེ་སྒོར་མོ་ཉི་དེ་བ་ ,nyi ma gcig bu de la yod a phA+on gcig bslebs red da rA/_phA+on de la e 'dra'i lab red da/_gcig ga re lab go red phA+on de la e 'dra'i lab red da/_ga re lab go re sgor mo nyi de ba _,https://d38pmlk0v88drf.cloudfront.net/wav16k/STT_CS-D-2012-P-D-B07-5-R-03_0034_298814_to_308331.wav,STT_CS,3,160,9.517,wav16k/STT_CS-D-2012-P-D-B07-5-R-03_0034_298814_to_308331.wav,ཉི་མ་གཅིག་བུ་དེ་ལ་ཡོད་བ།་ཕཱོན་གཅིག་སླེབས་རེད་ད་རཱ། ཕཱོན་དེ་ལ་ཨེ་འདྲའི་ལབ་རེད་ད། གཅིག་ག་རེ་ལབ་དགོས་རེད། དེ་ཕཱོན་དེ་ལ་ཨེ་འདྲའི་ལབ་རེད་དཱ། ག་རེ་ལབ་དགོས་རེད། སྒོར་མོ་ཡིས་ེ་
STT_CS-D-2012-P-D-B07-5-R-03_0035_308331_to_317849,དེབ་ཅིག་དེབ་ཅིག་ཡོད་རེད་ལབ་སོང་། འོ་དེ་ལ་དེབ་སྟོང་པ་ཡིན་ན་ག་རེ་འབྲི་ན་འོ་དེ་ཨང་ཀི་ཚང་མ་ཨང་ཀི་ཚང་མ་ཁོ་རང་ཁོ་རང་འབྲི་ཡོད་རེད། འོ་དེ་ལ་པད་ཤག་ག་ཚོད་རེད་ལབ་རེད་ད་རཱ། ཨེ་ནས་ཁོ་རང་ ,deb cig deb cig yod red lab song /_'o de la deb stong pa yin na ga re 'bri na 'o de ang ki tshang ma ang ki tshang ma kho rang kho rang 'bri yod red/_'o de la pad shag ga tshod red lab red da rA/_e nas kho rang _,https://d38pmlk0v88drf.cloudfront.net/wav16k/STT_CS-D-2012-P-D-B07-5-R-03_0035_308331_to_317849.wav,STT_CS,3,174,9.518,wav16k/STT_CS-D-2012-P-D-B07-5-R-03_0035_308331_to_317849.wav,དེབ་གཅིག་དེབ་གཅིག་ཡོད་རེད་ལབ་སོང་། འོ་དེ་ལ་དེབ་སྟོང་པ་རེད། ཡིན་ན་ག་རེ་བྲིས་ན་འོ་དེ་ཨང་ྩག་ཚང་མ། ཨང་རྩག་ཚང་མ་ཁོ་རང་ྔོ་ལ་བྲིས་རེད། འོ་དེ་ལ་པད་ཤག་ག་ཚོད་རེད་ལབ་རེད་ད་རཱ། ཨནཁོ་ཕོན་།
STT_CS-D-2012-P-D-B07-5-R-03_0036_318557_to_328514,པད་ཤག་ཡོད་བ་སྒོར་མོ་འབུམ་ག་རེ་ཡིན་ནའི་ཅིག་རེད་ལབ་རེད། ཨེ་ནས་ངའི་ལག་པ་ལ་པད་ཤག་མེད་ལབ་རེད་ད། ཨེ་ནས་ཁང་པ་ཚང་མ་ཡོད་བ་བཙོང་ནས་ཡོད་བ། ཁང་པ་ཚང་མ་བཙོང་ནས་པད་ཤག་ལེན་རེད་ད། ཨེ་ནས་ཉོས་རེད་ད་ཁོ་ཚོས་ ,pad shag yod ba sgor mo 'bum ga re yin na'i cig red lab red/_e nas nga'i lag pa la pad shag med lab red da/_e nas khang pa tshang ma yod ba btsong nas yod ba/_khang pa tshang ma btsong nas pad shag len red da/_e nas nyos red da kho tshos _,https://d38pmlk0v88drf.cloudfront.net/wav16k/STT_CS-D-2012-P-D-B07-5-R-03_0036_318557_to_328514.wav,STT_CS,3,187,9.957,wav16k/STT_CS-D-2012-P-D-B07-5-R-03_0036_318557_to_328514.wav,པད་ཤག་ཡོད་བ། སྒོར་མོ་འབུམ་ག་རེ་ཡིན་ན་གཅིག་རེད་ལབ་རེད། ཨ་ནསཔད་ཤག་མེད་ལབ་རེད་ད། ཨ་ནས་ཁང་པ་ཚང་མ་ཡོད་བ་བཙོང་ནས་ཡོད་བ། ཁང་པ་ཚང་མ་བཙོང་ནས་པད་ཤག་ལེན་རེད་ད། ཨེ་ནས་ཉོས་རེད་ད་རཱ། ཁོང་ཚོ། ཨ་ནས།
STT_CS-D-2012-P-D-B07-5-R-03_0037_329830_to_335424,ཨེ་ནས་ཁོ་ཚོ་གཉིས་བུ་བཀྲ་ཤིས་དེ་དང་བསྟན་འཛིན་དེ་ཡོད་བ། བུ་བཀྲ་ཤིས་དེ་དང་ ,e nas kho tsho gnyis bu bkra shis de dang bstan 'dzin de yod ba/_bu bkra shis de dang _,https://d38pmlk0v88drf.cloudfront.net/wav16k/STT_CS-D-2012-P-D-B07-5-R-03_0037_329830_to_335424.wav,STT_CS,3,72,5.594,wav16k/STT_CS-D-2012-P-D-B07-5-R-03_0037_329830_to_335424.wav,ཨ་ནས་ཁོང་ཚོ་གཉིས་བུ་བཀྲ་ཤིས་དེ་དང་བསྟན་འཛིན་དེ་ཡོད་བ། བུ་བཀྲ་ཤིས་དེ་དང་
STT_CS-D-2012-P-D-B07-5-R-03_0038_335424_to_341018,ཡོད་བ། བུ་བཀྲ་ཤིས་དེ་དང་བསྟན་འཛིན་དེ་བསྟན་འཛིན་དེ་དྲག་རེད་ད་རཱ། ནལིས་ནས་མར་བརྡབས་རྒྱོ་དེ། ཨེ་ནས་ ,yod ba/_bu bkra shis de dang bstan 'dzin de bstan 'dzin de drag red da rA/_nalis nas mar brdabs rgyo de/_e nas _,https://d38pmlk0v88drf.cloudfront.net/wav16k/STT_CS-D-2012-P-D-B07-5-R-03_0038_335424_to_341018.wav,STT_CS,3,97,5.594,wav16k/STT_CS-D-2012-P-D-B07-5-R-03_0038_335424_to_341018.wav,ཡོད་བ། བུ་བཀྲ་ཤིས་དེ་དང་བསྟན་འཛིན་དེ་བསྟན་འཛིན་དི་དྲག་རེད་ད་རཱ། སྨན་ནས་མར་བརཏབ་རྒྱོ་དེ། ཨེ་ནས།
STT_CS-D-2012-P-D-B07-5-R-03_0039_341710_to_350468,བུ་བཀྲ་ཤིས་དེ་ལ་ཡོད་བ་དགའ་བོ་ཅིག་ཡོད་རཱ་སྔོན་མ་ནས། ཨེ་ནས་འོ་དེ་ལ་ཡོད་བ་འོ་དེ་ལ། འོ་དེ་ལ་བྷའེ་བྷེ་སྐྱེས་རེད་ད་རཱ། ཨེ་ནས་བུ་བསྟན་འཛིན་དེ་ལ་ ,bu bkra shis de la yod ba dga' bo cig yod rA sngon ma nas/_e nas 'o de la yod ba 'o de la/_'o de la b+ha'e b+he skyes red da rA/_e nas bu bstan 'dzin de la _,https://d38pmlk0v88drf.cloudfront.net/wav16k/STT_CS-D-2012-P-D-B07-5-R-03_0039_341710_to_350468.wav,STT_CS,3,138,8.758,wav16k/STT_CS-D-2012-P-D-B07-5-R-03_0039_341710_to_350468.wav,བུ་བཀྲ་ཤིས་དེ་ལ་ཡོད་བ་དགའ་བོ་གཅིག་ཡོད་རཱ་ཡོད་ནས། ཨནས་འོ་དེ་ལ་ཡོད་བ། འོ་དེ འོ་དེ་ལ་བྷའེ་བྷེ་སྐྱེས་རེད་ད་རཱ། ཨེ་ནས་བུ་་བསྟན་འཛིན་དེ་ལ་
STT_CS-D-2012-P-D-B07-5-R-03_0040_351531_to_359226,དགའ་བོ་ཅིག་ཡོད་རེད་ད། འོ་དེ་ལ་བྷའེ་བྷེ་ཡོད་མ་རེད་ད། ཨེ་ནས་ཁོ་ཚོ་ཉི་མ་གཅིག་ལ་ཡོད་བ་ཉི་མ་གཅིག་ཁོ་ཚོ་སྨན་ཁང་ལ་འགྲོ་རེད་ད་རཱ། ཨེ་ནས་སྨན་ཁང་ལ་འགྲོ་དུས་སྐབས་དུ་ཡོད་བ་ ,dga' bo cig yod red da/_'o de la b+ha'e b+he yod ma red da/_e nas kho tsho nyi ma gcig la yod ba nyi ma gcig kho tsho sman khang la 'gro red da rA/_e nas sman khang la 'gro dus skabs du yod ba _,https://d38pmlk0v88drf.cloudfront.net/wav16k/STT_CS-D-2012-P-D-B07-5-R-03_0040_351531_to_359226.wav,STT_CS,3,161,7.695,wav16k/STT_CS-D-2012-P-D-B07-5-R-03_0040_351531_to_359226.wav,དགའ་བོ་གཅིག་ཡོད་རེད་ད། འོ་དེ་ལ་བྷའེ་བྷེ་ཡོད་མ་རེད་ད། ཨེ་ནས་ཁོང་ཚོ་ཉི་མ་གཅིག་ལ་ཡོད་བ། ཉི་མ་གཅིག་ཁོང་ཚོ་སྨན་ཁང་ལ་འགྲོ་རེད་ད་རཱ། ཨེ་ནས་སྨན་ཁང་ལ་འགྲོ་དུས་སྐབས་དུ་ཡོད་བ།
STT_CS-D-2012-P-D-B07-5-R-03_0041_360509_to_370359,སྨན་ཁང་ལ་འགྲོ་རེད་ད། ཨེ་ནས་ཁོ་ཚོ་གཉིས་སྨན་ཁང་ལ་འགྲོ་དུས་སྐབས་དུ། བསྟན་འཛིན་ཀ་ཅི་གྲོད་ཁོག་ནས་བསྟན་འཛིན་ཀ་ཅི་སྐྱེས་དམན་ཀ་ཅི་གྲོད་ཁོག་ནས་ཡོད་བ་ ,sman khang la 'gro red da/_e nas kho tsho gnyis sman khang la 'gro dus skabs du/_bstan 'dzin ka ci grod khog nas bstan 'dzin ka ci skyes dman ka ci grod khog nas yod ba _,https://d38pmlk0v88drf.cloudfront.net/wav16k/STT_CS-D-2012-P-D-B07-5-R-03_0041_360509_to_370359.wav,STT_CS,3,141,9.85,wav16k/STT_CS-D-2012-P-D-B07-5-R-03_0041_360509_to_370359.wav,སྨན་ཁང་ལ་འགྲོ་རེད་ད། ཨེ་ནས་ཁོང་ཚོ་གཉིས་སྨན་ཁང་ལ་འགྲོ་དུས་སྐབས་སུ་ ཁོ་ཚོ་བསྟན་འཛིན་ཀ་ཅི་གྲོགས་པོ་ཉི། བསྟན་འཛིན་ཀ་ཅི་སྐྱེས་དམན་ཀ་ཅི་གྲོད་ཁོག་ནས་ཡོད་བ།
STT_CS-D-2012-P-D-B07-5-R-03_0042_370359_to_380210,ག་རེ་ལབ་གོ་རེད། བསྟན་འཛིན་ཀ་ཅི་གྲོད་ཁོག་ནས་དེ་བཏོན་རེད་ད་རཱ་བྷའེ་བྷེ། བྷའེ་བྷེ་དངོས་གནས་ཡོད་མ་རེད་ད། པད་ཤག་ཅིག་སྤྲད་ནས་བྷའེ་བྷེ་བཏོན་རེད་ད། བྷའེ་བྷེ་ལབ་རེད་ད། ཨེ་ནས་ ,ga re lab go red/_bstan 'dzin ka ci grod khog nas de bton red da rA b+ha'e b+he/_b+ha'e b+he dngos gnas yod ma red da/_pad shag cig sprad nas b+ha'e b+he bton red da/_b+ha'e b+he lab red da/_e nas _,https://d38pmlk0v88drf.cloudfront.net/wav16k/STT_CS-D-2012-P-D-B07-5-R-03_0042_370359_to_380210.wav,STT_CS,3,166,9.851,wav16k/STT_CS-D-2012-P-D-B07-5-R-03_0042_370359_to_380210.wav,ག་རེ་ལབ་དགོས་རེད། བསྟན་འཛིན་གྱི་གྲོད་ཁོག་ནས་དི་སྟོན་རེད་ད་རཱ། བྷའེ་བྷེ། བྷའེ་བྷེ་དངོས་གནས་ཡོད་མ་རེད་ད། པད་ཤག་གཅིག་སྤྲད་ནས་བྷའེ་བྷེ་སྟོན་རེད་ད། བྷའེ་བྷེ་རག་རེད་ད། ཨན
