file_name,uni,wylie,url,dept,grade,char_len,audio_len,path,inf
STT_CS-D-2013-P-D-B04-4-R-06a_0008_60300_to_69935,གཅིག་ཁོ་རང་སྣ་ཁུང་ནང་ཨེ་འདྲའི་འདྲ་བོ་སྟོན་བསྡད་ཡོད་རེད་དཱ། ཨེ་ནས་ཡོད་བ། ཕག་པ་ལ་རོགས་པ་བྱས་རེད་དཱ། ཨེ་ནས། བོད་པ་དེ་ཕག་པ་ལ་རོགས་པ་བྱེད་བྱས་རེད། རྡོ་སྒང་ལ་འཛགས་རེད། བྱས་ཙང་སྦལ་པ་མཉམ་དུ་ ,gcig kho rang sna khung nang e 'dra'i 'dra bo ston bsdad yod red dA/_e nas yod ba/_phag pa la rogs pa byas red dA/_e nas/_bod pa de phag pa la rogs pa byed byas red/_rdo sgang la 'dzags red/_byas tsang sbal pa mnyam du _,https://d38pmlk0v88drf.cloudfront.net/wav16k/STT_CS-D-2013-P-D-B04-4-R-06a_0008_60300_to_69935.wav,STT_CS,3,183,9.635,wav16k/STT_CS-D-2013-P-D-B04-4-R-06a_0008_60300_to_69935.wav,ཅི་ཁོ་རང་སྣ་ཁུག་ཨེ་འདྲའི་འདྲ་བོ་བྟོན་བསྡད་ཡོད་རེད་ད། ཨེ་ནས་ཡོད་བ། ཕག་པ་ལ་རོགས་པ་བྱས་རེད་ད། ཨ་ནས་སྦལ་པ་དེ་ཕག་པ་རོགས་པ་བྱེས་བྱས་དས། རྡོ་སྒང་དྲ་ད་འགྲ་བྱས་དསསྦལ་པ་མཉམ་དུ་
STT_CS-D-2013-P-D-B04-4-R-06a_0009_69935_to_79570,འགྲོ་བསྡད་ཡོད་རེད་དཱ། སྦལ་པ་མཉམ་དུ་འགྲོ་དུས་སྐབས་སུ། ཨེ་ནས་ཁོ་ཚོ་ཡང་བསྐྱར་ཉོ་དགོས་འཁེལ་རེད། བྱིའུ་འདྲ་བོ་གཅིག་མཐོང་རེད། ཨེ་ནས་འོ་དེ་ཡོད་བ། འོ་དེའི་ཕར་ལ་སེམས་པ་སྐྱོ་ནས་བསྡད་བསྡད་ཡོད་རེད་ལབ་སོང་།  ,'gro bsdad yod red dA/_sbal pa mnyam du 'gro dus skabs su/_e nas kho tsho yang bskyar nyo dgos 'khel red/_byi'u 'dra bo gcig mthong red/_e nas 'o de yod ba/_'o de'i phar la sems pa skyo nas bsdad bsdad yod red lab song /__,https://d38pmlk0v88drf.cloudfront.net/wav16k/STT_CS-D-2013-P-D-B04-4-R-06a_0009_69935_to_79570.wav,STT_CS,3,195,9.635,wav16k/STT_CS-D-2013-P-D-B04-4-R-06a_0009_69935_to_79570.wav,འགྲོ་བསྡད་ཡོད་རེད་ད། ཨ་ནས་རོགས་པ་མཉམ་དུ་འགྲོ་དུས་སྐབས་སུ། ཨེ་ནས་ཁོང་ཚོ་ཡང་བསྐྱར་ཨ་ནས་ག་རེ། བྱིའུ་འདྲ་བོ་ཅིག་མཐོང་རེད་ད་ཡོད་བ། ཨེ་ནས་འོ་དེ་ཡོད་བ། འོ་དེ་ཕར་ལ་སེམས་པ་སྐྱོ་ནས་བསྡད་བསྡད་ཡོད་རེད་ད།
STT_CS-D-2013-P-D-B04-4-R-06a_0010_79570_to_89205,སེམས་པ་སྐྱོ་དུས་སྐབས་སུ་ཁོ་ཚོ་གཉིས་མཐོང་རེད་དཱ། ཁོ་ཚོ་གཉིས་ཀྱི་སྐད་ཆ། སྐད་ཆ་འདྲ་བོ་བཤད་བསྡད་རེད་དཱ། ཁོ་ཚོ་མཉམ་དུ། སྐད་ཆ་བཤད་དུས་སྐབས་དུས་ཨེ་འདྲའི་ལབ་རེད་དཱ། ཁྱོད་ག་རེ་བྱེད་སོང་ཨེ་འདྲའི་འདྲ་བོ་ལབ་རེད་དཱ། ཨེ་ནས་ཁོ།  ,sems pa skyo dus skabs su kho tsho gnyis mthong red dA/_kho tsho gnyis kyi skad cha/_skad cha 'dra bo bshad bsdad red dA/_kho tsho mnyam du/_skad cha bshad dus skabs dus e 'dra'i lab red dA/_khyod ga re byed song e 'dra'i 'dra bo lab red dA/_e nas kho/__,https://d38pmlk0v88drf.cloudfront.net/wav16k/STT_CS-D-2013-P-D-B04-4-R-06a_0010_79570_to_89205.wav,STT_CS,3,214,9.635,wav16k/STT_CS-D-2013-P-D-B04-4-R-06a_0010_79570_to_89205.wav,སེམས་པ་སྐྱོ་དུས་སྐབས་སུ། ཁོང་ཚོ་གཉིས་མཐོང་རེད་ད། ཁོ་ཚོ་གཉིས་སྐད་ཆ་སྐད་ཆ་འདྲ་བོ་བཤད་བསྡད་ཡོད་རེད་ད་ཱ། ཁོང་ཚོ་མཉམ་དུ་སྐད་ཆ་བཤད་དུས་སྐབས་དུ་ཨེ་འདྲའི་ལབ་ྱ་རེད་ད། ཁྱོད་ག་རེ་བྱས་སོང་ཨེ་འདྲའི་འདྲ་བོ་ལབ་རེད་ད། ཨ་ནས་ཁོ།
STT_CS-D-2013-P-D-B04-4-R-06a_0011_89205_to_98839,ག་རེ། ཁོ་རང་ཚོ་བུ་གུ་དེ་ཚོ་བརླགས་རེད། ང་བུ་གུ་བརླགས་སོང་ལབ་རེད་དཱ། བུ་གུ་བརླགས་དུས་ཁོ་ཚོ་སྒོ་ང་ཚང་དེ་མཐོང་རེད་རཱ། སྒོ་ང་ཚང་འདི་ཁོ་ཚོ། ཁོ་ཚོ་རོགས་པ་བྱེད་དགོས་ལབ་རེད་ད་རཱ།  ,ga re/_kho rang tsho bu gu de tsho brlags red/_nga bu gu brlags song lab red dA/_bu gu brlags dus kho tsho sgo nga tshang de mthong red rA/_sgo nga tshang 'di kho tsho/_kho tsho rogs pa byed dgos lab red da rA/__,https://d38pmlk0v88drf.cloudfront.net/wav16k/STT_CS-D-2013-P-D-B04-4-R-06a_0011_89205_to_98839.wav,STT_CS,3,171,9.634,wav16k/STT_CS-D-2013-P-D-B04-4-R-06a_0011_89205_to_98839.wav,ག་རེ ཁོ་རང་ཀ་ཅི་པུ་གུ་དེ་ཚོ་བརླག་དགོས། ང་པུ་གུ་བརླག་སོང་ལབ་རེད་ད། ཨེ་ནས་པུ་གུ་བརླག་དུས་ཁོ་ཚོ་སྒོ་ང་ཚང་དེ་མཐོང་རེད་། ཨ་ནས་སྒོ་ང་ཚང་དེ་ོ་ད་ཁོང་ཚོ་རོགས་པ་བྱེད་དགོས་ལབ་རེད་ད་ཡོད་བ།
STT_CS-D-2013-P-D-B04-4-R-06a_0012_98839_to_108474,རོགས་པ་བྱེད་ལབ་དུས། ཁོ་ཚོས་རོགས་པ་བྱེད་ཀ་འགྲོ་རེད་དཱ། རོགས་པ་བྱེད། བྱེད། ཉིན་མ་མང་པོ། ཉིན་མ་གཉིས་གསུམ་ཟི་འགྲོ་རེད་དཱ། ཉིན་མ་གཉིས་གསུམ་ཟི་འགྲོ་དུས་སྐབས་དུས། ཨེ་ནས་རང་འཇགས་ལ་རི་བོང་མཐོང་རེད་དཱ། རི་བོང།  ,rogs pa byed lab dus/_kho tshos rogs pa byed ka 'gro red dA/_rogs pa byed/_byed/_nyin ma mang po/_nyin ma gnyis gsum zi 'gro red dA/_nyin ma gnyis gsum zi 'gro dus skabs dus/_e nas rang 'jags la ri bong mthong red dA/_ri bong/__,https://d38pmlk0v88drf.cloudfront.net/wav16k/STT_CS-D-2013-P-D-B04-4-R-06a_0012_98839_to_108474.wav,STT_CS,3,201,9.635,wav16k/STT_CS-D-2013-P-D-B04-4-R-06a_0012_98839_to_108474.wav,རོགས་པ་བྱེད་ལ་ད་ཁོང་ཚོས་རོགས་པ་བྱེད་ག་འགྲོ་རེད་ད། རོགས་པ་བྱེས་སྡད། ཉི་མ་་ོ་ཉི་མ་གཉིས་གསུམ་ཟི་འགྲོ་རེད་ད། ཉི་མ་གཉིས་གསུམ་ཟི་འགྲོ་དུས་སྐབས་དུ་ཨ་ནས་རང་འཇགས་ལ་རི་བོང་མཐོང་རེད་ད། རི་བོང་།
STT_CS-D-2013-P-D-B04-4-R-06a_0013_108474_to_118109,རི་བོང་ཕར་ནང། ནང་ལ་བསྡད་བསྡད་ཡོད་རེད་ལབ་དུས་ཇ་པ་ཏིའི་ནང་ལ་རྩཱ་འདྲ་བོ་ཏིས་སི་ཟ་བསྡད་བསྡད་ཡོད་རཱ། ཨེ་ནས་ཡོད་བ། ཁོ་ཚོ་ཡོད་བ། ག་རེ། ད་བསྡད་བསྡད་ནས་རྩ་བ་ ,ri bong phar nang/_nang la bsdad bsdad yod red lab dus ja pa ti'i nang la rtsA 'dra bo tis si za bsdad bsdad yod rA/_e nas yod ba/_kho tsho yod ba/_ga re/_da bsdad bsdad nas rtsa ba _,https://d38pmlk0v88drf.cloudfront.net/wav16k/STT_CS-D-2013-P-D-B04-4-R-06a_0013_108474_to_118109.wav,STT_CS,3,149,9.635,wav16k/STT_CS-D-2013-P-D-B04-4-R-06a_0013_108474_to_118109.wav,རི་བོང་པ་ནང་ནང་ལ་བསྡད་བསྡད་ཡོད་རེད་ད།  ཇ་བབ་དུ་ནང་ལ་རྩྭ་འདྲ་བོ་ཏིག་ཙི་ཟ་བསྡད་བསྡད་ཡོད་རེད་ད། ཨེ་ནས་ཡོད་བ། ཁོང་ཚོ་ཡོད་བ། ག་རེ།ད་བསྡད་བསྡད་ན་རྩ
STT_CS-D-2013-P-D-B04-4-R-06a_0014_118109_to_127744,སྒང་ལ་ཨེ་འདྲའི་འདྲ་བོ་བྱེད་བྱེད་ནས་བྱི་བ་མཐོང་རེད་དཱ། ཨེ་ནས་ཁོ་ཚོ་སླེབས་རེད་དཱ། ཁོ་ཚོ་སླེབས་དུས་སྐབས་དུ་རི་བོང་ལྔ་མཐོང་རེད་དཱ། རི་བོང་ལྔ་ཏིས་སི་ཏིས་སི་སེམས་པ་སྐྱོ་བསྡད་ཡོད་རེད་དཱ། ཆར་པ་བབས་དུས། ཨེ་ནས་ ,sgang la e 'dra'i 'dra bo byed byed nas byi ba mthong red dA/_e nas kho tsho slebs red dA/_kho tsho slebs dus skabs du ri bong lnga mthong red dA/_ri bong lnga tis si tis si sems pa skyo bsdad yod red dA/_char pa babs dus/_e nas _,https://d38pmlk0v88drf.cloudfront.net/wav16k/STT_CS-D-2013-P-D-B04-4-R-06a_0014_118109_to_127744.wav,STT_CS,3,201,9.635,wav16k/STT_CS-D-2013-P-D-B04-4-R-06a_0014_118109_to_127744.wav,སྒང་ལ་ཨེ་འདྲའི་འདྲ་བོ་བྱེས་བྱས་ནས།་ནསཕྱུ་བ་མཐོང་རེད་ད། ཨ་ནས་ཁོང་ཚོ་སླེབས་རེད་ད། ཁོང་ཚོ་སླེབ་དུས་སྐབརི་བོང་ྒ་མཐོང་རེད་ད། རི་བོང་ྒང་ཏིག་ཙི་ཏིག་ཙི་སེམས་པ་སྐྱོ་བསྡད་ཡོད་རེད་ད། ཆར་། ཨས
STT_CS-D-2013-P-D-B04-4-R-06a_0015_127744_to_137379,རི་བོང་ལ་ཨེ་འདྲའི་ལབ་རེད་དཱ། ཁྱོད་ཚོ་ག་རེ་བྱས་སོང་ལབ་རེད། ང་ཡོད་བ། ཆར་པ་བབས་ནས་སེམས་པ་སྐྱིད་བོ་མི་འདུག་ལབ་རེད་དཱ། ང་རྩྭ་ཞེ་དྲག་འཁྱེར་སླེབས་མེད་ལབ་རེད་ད་རཱ། ང་གྲོད་ཁོག་ལྟོགས་ཀྱི་འདུག་ལབ་རེད་དཱ། ཨེ་ནས་ང་ཚོ་ ,ri bong la e 'dra'i lab red dA/_khyod tsho ga re byas song lab red/_nga yod ba/_char pa babs nas sems pa skyid bo mi 'dug lab red dA/_nga rtswa zhe drag 'khyer slebs med lab red da rA/_nga grod khog ltogs kyi 'dug lab red dA/_e nas nga tsho _,https://d38pmlk0v88drf.cloudfront.net/wav16k/STT_CS-D-2013-P-D-B04-4-R-06a_0015_127744_to_137379.wav,STT_CS,3,205,9.635,wav16k/STT_CS-D-2013-P-D-B04-4-R-06a_0015_127744_to_137379.wav,་ལ་ཨེ་འདྲའི་ལབ་རེད་ད། ཁྱོད་ཚོ་ག་རེ་བྱས་སོང་ལབ་རེད་ད། ང་ཡོད་་ཚ་བ་ན་སེམས་པ་སྐྱིད་པོ་མི་འདུག་ལབ་རེད་ད། ང་རྩྭ་ཞེ་དྲག་ཁྱེར་སླེབས་ཀྱི་མེད་ལབ་རེད་ད། ང་ཛོར་པོ་ལྟགས་ཀྱི་འདུག་ལབ་རེད་ད། ཨ་ནས་ང་ཚོ་
STT_CS-D-2013-P-D-B04-4-R-06a_0016_137379_to_147014,ང་ལ་རོགས་པ་བྱེད་དགོས་ལབ་རེད་དཱ་ཁོ་ཚོ་ཡིས། རོགས་པ་བྱེད་དགོས་ལབ་དུས་རོགས་པ་བྱེད་ཀ་འགྲོ་དུས་སྐབས་དུས་རྩྭ་ཏིས་སི་མང་པོ། མང་པོ་འཁྱེར་སླེབས་རེད་དཱ། ཨེ་ནས། རྩྭ་མང་པོ་འཁྱེར་སླེབས་དུས་སྐབས་སུ་ཨེ་ནས་ཁོ་ཚོ་མཉམ་དུ་འགྲོ་རེད་དཱ།  ,nga la rogs pa byed dgos lab red dA kho tsho yis/_rogs pa byed dgos lab dus rogs pa byed ka 'gro dus skabs dus rtswa tis si mang po/_mang po 'khyer slebs red dA/_e nas/_rtswa mang po 'khyer slebs dus skabs su e nas kho tsho mnyam du 'gro red dA/__,https://d38pmlk0v88drf.cloudfront.net/wav16k/STT_CS-D-2013-P-D-B04-4-R-06a_0016_137379_to_147014.wav,STT_CS,3,216,9.635,wav16k/STT_CS-D-2013-P-D-B04-4-R-06a_0016_137379_to_147014.wav,ང་ཡི་རོགས་པ་བྱེད་དགོས་ལབ་རེད་ད། ཁོང་ཚོ་ཡིས་རོགས་པ་བྱེད་དགོས་ལབ་རེད་།  རོགས་པ་བྱེད་ག་འགྲོ་དུས་སྐབས་དུ་ ཨ་ནས་རྩྭ་ཏིག་ཙི་མང་པོ་མང་པོ་འཁྱེར་སླེབས་རེད་ད། ཨེ་ནས་རྩྭ་མང་པོ་འཁྱེར་སླེབས་དུས་སྐབས་སུ། ཨ་ནས་ཁོང་ཚོ་མཉམ་དུ་འགྲོ་རེད་དཱ།
STT_CS-D-2013-P-D-B04-4-R-06a_0017_147014_to_156649,ཨེ་ནས་ཁོ་ཚོ་མཉམ་དུ་འགྲོ་དུས་སྐབས་དུས་རང་འཇགས་ཡོད་བ། རྡོ་འདྲ་བོ་གཅིག་མཐོང་རེད་དཱ། རྡོ། ནང་འདྲ་བོ་གཅིག་མཐོང་རེད་དཱ། ཨེ་ནས་འོ་དེའི་སྐབས་དུས་ཁོ་ཡི་སྦལ་པ་འདི་མཆོང་རེད་དཱ། མཆོང་དུས་སྐབས་དུས། ཨེ་ནས་ལོ་མ་ ,e nas kho tsho mnyam du 'gro dus skabs dus rang 'jags yod ba/_rdo 'dra bo gcig mthong red dA/_rdo/_nang 'dra bo gcig mthong red dA/_e nas 'o de'i skabs dus kho yi sbal pa 'di mchong red dA/_mchong dus skabs dus/_e nas lo ma _,https://d38pmlk0v88drf.cloudfront.net/wav16k/STT_CS-D-2013-P-D-B04-4-R-06a_0017_147014_to_156649.wav,STT_CS,3,197,9.635,wav16k/STT_CS-D-2013-P-D-B04-4-R-06a_0017_147014_to_156649.wav,ཨེ་ནས་ཁོང་ཚོ་ཨེ་འདྲའི་འགྲོ་དུས་སྐབས་སུ། རང་འཇགས་ཡོད་བ། རྡོ་འདྲ་བོ་གཅིག་མཐོང་རེད་ད། རྡོ། ནང་འདྲ་བོ་ཅིག་མཐོང་རེད་ད། ཨེ་ནས་འོ་དེའི་སྐབས་དུས་ཁོ་སྦལ་པ་དེ་མཆོང་རེད་ད། མཆོང་དུས་སྐབས་སུཨ་ནས་ལོ་མ་་སུ
STT_CS-D-2013-P-D-B04-4-R-06a_0018_156649_to_166283,ཁོ་ཡི་ཡོད་བ། ཆུ་ནང་ཨེ་འདྲའི་འདྲ་བོ་སྐྱིད་པོ་བྱེད་ནས་བསྡད་བསྡད་ཡོད་རེད་དཱ། ཆར་བའི་ནང་ལོགས་ལ། སྐྱིད་བོ་བྱེད་ནས་བསྡད་བསྡད་ཡོད་རེད་དཱ། བསྡད་བསྡད་དུས་སྐབས་དུས་ཨེ་ནས་ལམ་ཁ་ནས་ཡོད་བ། ཨ་ག་རེ། གཅིག་སེམས་ཅན་གཅིག་སླེབས་རེད་དཱ། ཨེ་ནས་སེམས་ ,kho yi yod ba/_chu nang e 'dra'i 'dra bo skyid po byed nas bsdad bsdad yod red dA/_char ba'i nang logs la/_skyid bo byed nas bsdad bsdad yod red dA/_bsdad bsdad dus skabs dus e nas lam kha nas yod ba/_a ga re/_gcig sems can gcig slebs red dA/_e nas sems _,https://d38pmlk0v88drf.cloudfront.net/wav16k/STT_CS-D-2013-P-D-B04-4-R-06a_0018_156649_to_166283.wav,STT_CS,3,227,9.634,wav16k/STT_CS-D-2013-P-D-B04-4-R-06a_0018_156649_to_166283.wav,ཁོ་ཡོད་བ། ཆུ་ནང་ཨེ་འདྲའི་འདྲ་བོ་སྐྱིད་པོ་བྱས་ནས་བསྡད་བསྡད་ཡོད་རེད་ད། ཆ་་་་སྐྱིད་པོ་བྱས་ནས་བསྡད་བསྡད་ཡོད་རེད་ད། ཨེ་ནས་བསྡད་བསྡད་དུས་སྐབས་སུ།ཨ་ནས་རང་ཇགས་ནས་ཡོད་བ། ག་རེགཅིག་སེམས་ཅན་གཅིག་སླེབས་རེད་ད། སེམས
STT_TT00059_01859.950-01861.700,འུམ། བདག་ཏུ་འཛིན་པ་དེ་ ,'um/_bdag tu 'dzin pa de _,https://d38pmlk0v88drf.cloudfront.net/wav16k/STT_TT00059_01859.950-01861.700.wav,STT_TT,3,23,1.75,wav16k/STT_TT00059_01859.950-01861.700.wav,ཨུམ། བདག་ཏུ་འཛིན་པ་དེ།
STT_TT00059_01862.000-01864.500,ཟློག་དགོས་ཀི་ཡོད་རེད། བདག་ཏུ་འཛིན་པ་ཟློག་ཡ་དེ་ ,zlog dgos ki yod red/_bdag tu 'dzin pa zlog ya de _,https://d38pmlk0v88drf.cloudfront.net/wav16k/STT_TT00059_01862.000-01864.500.wav,STT_TT,3,47,2.5,wav16k/STT_TT00059_01862.000-01864.500.wav,ཟློག་དགོས་ཀི་ཡོད་རེད། བདག་ཏུ་འཛིན་པ་བཟློག་ཡ་དེ།
STT_TT00059_01864.750-01866.200,ཨེ་ནས་བདག་མེད་པའི་ལྟ་བ་ ,e nas bdag med pa'i lta ba _,https://d38pmlk0v88drf.cloudfront.net/wav16k/STT_TT00059_01864.750-01866.200.wav,STT_TT,3,24,1.4500000000000457,wav16k/STT_TT00059_01864.750-01866.200.wav,ཨེ་ནས། བདག་མེད་པའི་ལྟ་བ།
STT_TT00059_01868.050-01869.400,ཐོས་བསམ་སྒོམ་གསུམ་བྱས་ནས་ ,thos bsam sgom gsum byas nas _,https://d38pmlk0v88drf.cloudfront.net/wav16k/STT_TT00059_01868.050-01869.400.wav,STT_TT,3,26,1.3500000000001364,wav16k/STT_TT00059_01868.050-01869.400.wav,ཐོས་བསམ་སྒོམ་གསུམ་བྱས་ནས།
STT_TT00059_01869.600-01871.250,ད་ཉམས་མྱོང་སྐྱེས་པའི་སྒོ་ནས་ ,da nyams myong skyes pa'i sgo nas _,https://d38pmlk0v88drf.cloudfront.net/wav16k/STT_TT00059_01869.600-01871.250.wav,STT_TT,3,29,1.650000000000091,wav16k/STT_TT00059_01869.600-01871.250.wav,ད་ཉམས་མྱོང་སྐྱེས་པའི་སྒོ་ནས།
STT_TT00059_01871.650-01872.550,ཨེ་ནས་འོ་ད་ ,e nas 'o da _,https://d38pmlk0v88drf.cloudfront.net/wav16k/STT_TT00059_01871.650-01872.550.wav,STT_TT,3,12,0.8999999999998636,wav16k/STT_TT00059_01871.650-01872.550.wav,ཨེ་ནས་འོ་ད་
STT_NS0026_0167_1369671_to_1379521,བསམ་གི་འདུག ག་རེ་བྱེད་ནས། ལམ་སང་ད་ང་ཚོ་ད་ཆུ་ཚོད་ག་ཚོད་ཡིན་མིན་ལྟ་ཤོར་ན་ཡང་། ཁ་པར་ལྟ་དགོས་འདུག་བ། འོ་དེས་ཡང་དེ་ཏིས་སི་ཅིག་ཁ་པར་ལ་ཨེ་འདྲའི་སི་ཏིས་སི་ཐག་རིང་བ་འགྲོ་ཡ་ལ། ཡང་སོ་སོ་གི་ལག་པ་ལ་ཆུ་ཚོད་དེ་དཔེ་ད་བཏགས་ཡ་གལ་ཆེན་པོ་རེད། ག་རེ་བྱེད་ནས་ད་ང་ཚོ་གི་ ,bsam gi 'dug_ga re byed nas/_lam sang da nga tsho da chu tshod ga tshod yin min lta shor na yang /_kha par lta dgos 'dug ba/_'o des yang de tis si cig kha par la e 'dra'i si tis si thag ring ba 'gro ya la/_yang so so gi lag pa la chu tshod de dpe da btags ya gal chen po red/_ga re byed nas da nga tsho gi _,https://d38pmlk0v88drf.cloudfront.net/wav16k/STT_NS0026_0167_1369671_to_1379521.wav,STT_NS,3,247,9.85,wav16k/STT_NS0026_0167_1369671_to_1379521.wav,བསམ་ི་འདུག ག་རེ་བྱས་ནལམ་སང་ད་ང་ཚོ་ད་ཆུ་ཚོད་ག་ཚོད་ལྟ་བཞག་ན་ཡང་ཁ་པར་ལྟ་དགོས་འདུག་བ། འོ་དེ་ཡང་དེ་ཏོག་ཙི་ཅིག་ཁ་པར་ལ་ཏོག་ཙི་ཐག་རིང་དུ་འགྲོ་ཡར། ཡང་སོ་སོ་གི་ལག་པ་ལ་ཆུ་ཚོད་དེ་དཔེ་ལྟ་བསྡད་ཡ་གལ་ཆེན་པོ་རེད། ག་རེ་བྱས་ང་ཚོ་གི
STT_NS0026_0168_1379521_to_1389371,ཨེ་ད་ཁ་པར་ལ་ལྟ་མོ་དགོས་བ་བྱེད། ཁར་ཐུག་ཆུ་ཚོད་ལ་ལྟ་ཡ་ཡོད་རཱ། འོ་དེས་ཡང་ཏིས་སི་གལ་ཆེན་པོ་མཐོང་གི་འདུག་རཱ། ཨ་ནས། ཨུན་། དམིགས་བསལ་གི་ད་ང་ཚོ་གི་ཨེ་དགོང་དག་མ་ཉལ་དུས་ཙམ་པ་ ,e da kha par la lta mo dgos ba byed/_khar thug chu tshod la lta ya yod rA/_'o des yang tis si gal chen po mthong gi 'dug rA/_a nas/_un /_dmigs bsal gi da nga tsho gi e dgong dag ma nyal dus tsam pa _,https://d38pmlk0v88drf.cloudfront.net/wav16k/STT_NS0026_0168_1379521_to_1389371.wav,STT_NS,3,165,9.85,wav16k/STT_NS0026_0168_1379521_to_1389371.wav,ད་ཁ་པར་ལྟ་མི་དགོས་པ་བྱས། ཁ་ཐུག་ཆུ་ཚོད་ལྟ་ཡ་ཡོད་རེད་བ།  འོ་དེ་ཡང་ཏོག་ཙི་གལ་ཆེན་པོ་མཐོང་གི་འདུག་རེད་བ། ཨེ་ནས་དམིགས་བསལ་གི་ད་ང་ཚོ་གི་དགོང་ད་མང་བ་ཉོད་དུས་ཙམ་པ་
STT_NS0026_0169_1389371_to_1399221,ཁ་པར་དེ་ཏིས་སི་ཐག་རིང་པོ་བཞག་དགོས་རེད་ལབ་གི་འདུག་བ། འུན་། ང་ཚོ་མཉམ་དུ་ཉར་ན་ཏིས་སི་ག་རེ་ལབ་དགོས་རེད་ད། མཉམ་དུ་གཟུགས་པོ་ལ་གནོད་པོ། གཟུགས་ལོ་ལ་གནོད་པོ་ཡོད་རེད་ལབ་གི་འདུག་བ། ཁོང་ཚོས་ཏིས་སི། ཨ་དེ་ཡོད་རེད་ལབ་གི་འདུག་བ་ད།  ,kha par de tis si thag ring po bzhag dgos red lab gi 'dug ba/_'un /_nga tsho mnyam du nyar na tis si ga re lab dgos red da/_mnyam du gzugs po la gnod po/_gzugs lo la gnod po yod red lab gi 'dug ba/_khong tshos tis si/_a de yod red lab gi 'dug ba da/__,https://d38pmlk0v88drf.cloudfront.net/wav16k/STT_NS0026_0169_1389371_to_1399221.wav,STT_NS,3,216,9.85,wav16k/STT_NS0026_0169_1389371_to_1399221.wav,ཁ་པར་དེ་ཏོག་ཙི་ཐག་རིང་པོ་བཞག་དགོས་རེད་ལབ་ཀི་འདུག་བ། ཨུན་ཧུ། ང་ཚོ་མཉམ་དུ་ཉར་ན་ཏོག་ཙི་ག་རེ་ལབ་དགོས་རེད་ད། མཉམ་དུ་གཟུགས་པོ་ལ་གནས་པོ། གཟུགས་པོ་ལ་གནས་ྤོ་ཡོད་ལབ་ཀི་འདུག་བ།། ཁོ་ཚོ་ཏོག་ཙི་དེ་ཡོད་རེད་ལབ་ཀི་འདུག་ད།
